{
  "T": 5,
  "vehicles": 3,
  "zones": 3,
  "workers": [
    {
      "id": 0,
      "availabilities": [0, 1, 2],
      "skills": []
    },
    {
      "id": 1,
      "availabilities": [0, 1, 2],
      "skills": []
    },
    {
      "id": 2,
      "availabilities": [1, 2, 3],
      "skills": []
    },
    {
      "id": 3,
      "availabilities": [3, 4, 0],
      "skills": []
    }
  ],
  "workersIncompatibilities": [
    [0, 2]
  ],
  "demands": [
    {
      "id": 0,
      "periods": [0, 1, 2],
      "requiredWorkers": [{}, {}],
      "vehicles": 1
    },
    {
      "id": 1,
      "periods": [1, 2, 3],
      "requiredWorkers": 1,
      "vehicles": 1
    },
    {
      "id": 2,
      "periods": [0, 3, 4],
      "requiredWorkers": 1,
      "vehicles": 0
    }
  ]
}


